{
  "schemaVersion": 1,
  "id": "redir_01HZX8K3Q9R1",
  "siteId": "site_01HZX8K3Q9EF",
  "from": "/posts/first-agent-article",
  "to": "/posts/first-agent-written-article",
  "status": 301,
  "match": "exact",
  "reason": "slug-change",
  "source": {
    "kind": "contentEntry",
    "id": "entry_01HZX8K3Q9WX"
  },
  "rev": 0,
  "createdAt": "2026-10-08T10:00:00Z",
  "updatedAt": "2026-10-08T10:00:00Z"
}
