{
  "schemaVersion": 1,
  "id": "redir_01HZX8K3Q9R2",
  "siteId": "site_01HZX8K3Q9EF",
  "from": "/category/ai",
  "to": "/category/artificial-intelligence",
  "status": 301,
  "match": "prefix",
  "reason": "slug-change",
  "source": {
    "kind": "term",
    "id": "term_01HZX8K3Q9AI"
  },
  "rev": 0,
  "createdAt": "2026-10-08T10:00:00Z",
  "updatedAt": "2026-10-08T10:00:00Z"
}
